題目,主題A,主題B,主題C,正確主題,老實人解釋,解釋
天邊一朵雲,影視,小說,物理,影視,2005年臺灣電影，上映前因為影片涉及色情而引發爭議，讓該片在台灣上映之前就充滿話題性，經行政院新聞局電影處的15位人員表決之下，以一刀未剪通過審議。因媒體皆圍繞在炒作其性變話題上，有不少民眾抱著看熱鬧的心情而進電影院觀賞。,
安藤百福,企業,人物,飲食,企業,台灣裔日本人，生於日屬臺灣嘉義，鹿模仔腳街的企業家，早年曾致力於麵條改良，製成現代化快速沖泡即可方便食用的泡麵，並創辦日清食品公司，是泡麵和杯麵的發明者。,
抓大放小,物理,博弈,企業,博弈,中國政府在1995年面對國企改革問題時提出的應對方針。抓大：扶持大型國企，改善其管理水平及提升競爭力。放小：對於中小型企業，採取相對靈活，甚至放任的姿態，把它們直接推向市場。,
油鬼仔,傳說,物理,宗教,傳說,是馬來族文化傳說中內學／隱秘之學的一種，學了這類巫術後就可以來去自如，類似中國文化的穿牆術之類的傳說。油鬼仔的獨門技巧是身上非常光滑，以致可以輕易地「滑進」人們住所偷竊或者做其他犯罪活動，即使被逮捕，也因為身體光滑而輕易的從逮捕者的指尖「滑走」。,
鍵盤小妹,網路,用語,文化,網路,是ptt的一種現象及流行用語。指冒充女性使用者的男性鄉民。ptt的使用者以男性為多，從早期開始就常有冒充女生的用戶，例如使用女性化的ID或暱稱。但這種「小妹文」，其中不乏冒充性別以獲得便利的人。,
普隆德拉,物理,遊戲,宗教,遊戲,是遊戲「仙境傳說」中，位於大陸交通重心，也是盧恩－米德加茲王國的首都。其熱鬧程度自然不在話下；正因為它的重要性，冒險家們漸漸地以「主城」來稱呼這個繁榮的都市。集合了來自四面八方的人們，自然而然的也形成了最具規模的市場，不論是新手或是老手，如果沒有來過這座城市的話連冒險者這個稱呼都談不上。,
毒鵝膏,毒物,保健食品,生物,毒物,為一種劇毒真菌，廣泛分布在亞歐大陸，菌傘一般呈現綠色，並且有白色的菌柄和菌褶。這種菇類在人類因毒菇中毒而死亡的比例中超過了半數，並且有可能是羅馬皇帝克勞狄烏斯和神聖羅馬帝國皇帝查理六世的死因。,
法老之蛇,傳說,藝術,化學,化學,是一種爆竹，又稱蛇炮，被點燃後會產生煙，通過膨脹呈現出類似蛇的形態。這類爆竹會在地上安靜燃燒並可能釋放煙氣，但不產生火花或耀眼的光，不會迸出物體，不發出聲音。簡易的實驗材料有：貓砂、糖、酒精、小蘇打粉。,
香蕉戰爭,戰役,小說,影視,戰役,指1898－1934年間美國對中美洲和加勒比海地區的一系列占領、未宣戰的軍事行動與內政操控。這一時期開始於1898年的美西戰爭和隨後的巴黎條約，使美國控制住古巴和波多黎各。作家萊斯特．D．蘭利寫了數本關於拉丁美洲歷史和美國干預的書籍，當中他以「香蕉戰爭」及「香蕉共和國」形容美國的干預及被干預的國家。,
豐乳肥臀,小說,文學,文化,小說,是中國作家莫言最具爭議也最受歡迎的長篇小說。全書主要刻畫了一個從抗日戰爭到改革開放後的偉大母親形象。,
魔鬼蛋,飲食,料理,文化,飲食,起源於義大利，又稱作填料蛋、俄羅斯蛋、調製蛋。做法：將蛋煮熟後剖切半，將蛋黃與美乃滋或芥末醬混和後填回的餐點。此餐點常作為冷食，為配菜、開胃餐或主餐，通常會於假日或派對時出菜。在歐洲與北美很受歡迎。,
灰姑娘效應,心理學,物理,密碼,心理學,是一個演化心理學術語，源於童話《灰姑娘》，指繼子或繼女受到其繼父母虐打、性虐待、忽視、謀殺等其他虐待的比率明顯高於親生父母親子關係的現象。,
天使抽稅,傳說,飲食,博弈,傳說,蘇格蘭人會用橡木桶儲存威士忌，但桶內的威士忌每年都會有2-4%揮發到空氣中，故人們稱這個現象為天使抽稅，意指酒被天使偷偷喝掉。,
大人買,消費,經濟,文化,消費,指成年消費者利用自身財力，大量購買針對兒童青少年為對象的商品（如：玩具、零食、整套漫畫書及模型等）的行為，即「同一個東西買很多個」。,
收皮,用語,網路,文化,用語,是香港較粗俗的用語，意思是叫人住口或滾蛋。,
薪能,環保,表演,科技,表演,是日本能樂的一種，意為「薪火之宴時的能樂」。主要在夏日的夜間舉辦，人們在能樂堂或野外臨時搭建的能舞台周圍點燃火堆，挑選特定的能樂曲目進行表演。,
拉撒路現象,生理現象,醫學,宗教,生理現象,又稱為拉撒路反射。該現象會發生在腦死病患身上，當病患已經被判定腦死之後，只要碰觸到特定的脊椎位置，就會突然雙手舉高，之後將雙手在胸前交叉，像復活過來一樣。但該現象只會發生在部分病患上（約13%），並非所有人皆是如此。拉薩路是一位聖經中的人物，因為耶穌的能力而復活。,
心意把,心理學,武功,器具,武功,為少林寺武僧研習心意拳所推演出來的一種散招拳法。,
小豆洗,蔬菜,傳說,物理,傳說,又稱為「小豆淘」、「洗豆妖」。日本傳說中，是一種在河川邊出現，會發出「窸窸窣窣」像淘洗小豆一樣聲音的妖怪，聲音可以傳得很遠，即使走出了十町地（約合1公里）還能聽到。,
橄葉環,頭冠,宗教,裝飾,頭冠,一種以橄欖葉編織而成的花冠狀頭冠。在古羅馬時代為公民能獲得的次高軍事勳章，僅次於禾草環。它被頒授於那些以實際行動拯救同胞於危難中的羅馬公民。,
腺毛馬藍,植物,物理,生態,植物,"為中國的特有植物。分布於中國雲南等地，生長於海拔800米至3,000米的地區，常生於林下或草坡，目前尚未由人工引種栽培。",
自律期,兒童,時代,個性,兒童,英國學者提出兒童在8歲以上時，能夠理解規則是可以打破的，並認為自己可以制定規則。,
黑暗餐廳,實驗,料理,風景,實驗,一種主打無燈光料理的餐廳，客人需要在全黑的狀況下用餐。,
泡泡聊天,付費,活動,社交,活動,一種由偶像或藝人的聊天互動方式，粉絲可以透過付費與藝人進行一對一的私人聊天，因為聊天的對話框很像泡泡的形狀而得名。,
鷹架論,教學,建築,動物,教學,一種教學的方式，教師提供學生在學習上的輔助，讓學生可以快速理解知識。,
利他能,藥物,運動,能力,藥物,是一種藥物，提供注意力不足過動症之患者使用，使其疲累致無法做出過多動作。,
螞蟻農夫,昆蟲,作物,活動,昆蟲,位於南美洲的割葉蟻，會在巢穴中種植真菌來當食物。,
漂鳥學校,部落,教育,動畫,教育,非洲有些部落會隨著季節進行移動，同時學生也會跟著漂流。,
拿了錢就跑,藝術品,網路用語,歌曲,藝術品,一位藝術家被博物館邀請，結果收了錢之後只給了兩幅空白的作品，並取名為「拿了錢就跑」。,
垃圾桶決策,解決問題,物品,商業,解決問題,一種決策的方式，將所有雜亂難解的人聚集在一起，討論大家隨機提供解決方法。,
窗戶進街,博物館,建築,購物,購物,在逛街時只有觀賞而已，不進行購買的動作。,
巴斯卡三角形,數學,建築,武器,數學,一種數列的寫法，意指將數字相乘後可以形成一個類似金字塔的三角形。,
鉤吻,植物,動物,武器,植物,中國傳統毒藥植物，也叫「斷腸草」，微量即可致命。,
光暈,物品,地區,現象,現象,太陽或月亮周圍出現的彩色光環，因水滴或冰晶繞射形成。,
空氣花,植物,水果,遊戲,植物,一種鳳梨，不需要土壤就可以生長，只要吸收空氣中的水分就可以生存。,
鴿子與豌豆,藝術品,藥物,活動,藝術品,是一幅畢卡索的作品，在2010年之前放在巴黎藝術博物館，但是被盜取現後來找回來。,
伏爾沙瓦動作,宇宙現象,生物,運動,生物,在運動時憋氣，使腹壓上升，再吐氣，以減緩心悸。可增加力量及防止受傷。對舉重選手來說，憋氣可以幫助身體舉起更大的重量。,
糖蜜災難,生理,料理,事件,事件,美國波士頓名為北區的住宅區中一座巨大糖蜜儲存槽所引起的災難。滾燙的糖蜜波浪快速的沖入周圍的街道，導致多人傷亡。,
狐狸叫,地名,生物現象,民俗文化,地名,在香港西貢地區的一個地名，因為有很多山貓、貓頭鷹之類的動物，這些動物移動的速度跟狐狸一樣快，因此得名。,
恆河猴實驗,心理學,天氣現象,購物,心理學,一種心理學的實驗，將剛出生的恆河猴帶離母猴身邊，並提供一隻具有攻擊性的鐵製假猴，小猴會將鐵製假猴視為母親並依附在他身上。意思為孩子對於母愛的需求大於受到攻擊的恐懼。,
帕夫洛夫的狗,音樂,現象,生物本能,生物本能,學者帕夫洛夫做的實驗，在狗聽到開罐頭的聲音時，就會開始不自覺的流口水，表示針對他人行為的條件反射。,
蝌蚪啃蠟,飲料,水果,建築,飲料,可口可樂在銷售到中國時的第一個名字，但因音譯的關係，聽起來很不好聽，因此改名為現今的可口可樂。,
問間觀音,寺廟,宗教活動,藝術品,宗教活動,是全日本唯一一個供奉對象為乳房的神社，代表的神意是尊子千歲，據說這寺院在哪兒，育兒、乳房發育、安全分娩、求子等方面都很靈驗。,
噶蛋教,宗教,隱喻,心理學,隱喻,一貫道宗教的前身，因為該宗教時代衣料就是「口」，將其比喻為還未孵化的噶蛋，因此得名。,
廚所女神,音樂,料理,都市傳說,音樂,是日本歌手的單曲，於2010年發行，是該歌手的成名作和代表歌曲。為紀念外祖母的感人歌曲，內容是跟外祖母一起整理廁所所發生的狀況。,
亞東六眼幽靈,昆蟲,都市傳說,人物,昆蟲,為幽靈蛾科六眼幽靈蛾屬的動物。在中國大陸，分布於西藏等地，主要生活於石縫、洞穴間。,
拉菲爾心理,藝術品,心理學,運動,心理學,拉菲爾為15世紀的藝術家，人們希望望著自己架構畫中的完美樣貌，但拉菲爾卻在自畫像中寫實描繪自己的不滿足，都想要改造自己的樣子。,
飛特族,工作,性質,運動習慣,工作,意指以兼職工作來維持生計的人，部分飛特族人士收入難以建立家庭，亦難以於事業上有晉升，基本上都是單人或是依賴父母生活。,
貝佛里奇的五大巨人,建築物,社會問題,武器,社會問題,英國經濟學者貝佛里奇指出社會經濟問題中的五大威脅：貧窮、疾病、無知、肮髒和懶惰，每一個都會影響到社會的經濟進步速度。,
老鼠樂園,藝術品,心理學,植物,心理學,加拿大学者提出毒品藥物成癮實驗，發現老鼠因為環境的壓力所造成，因此將老鼠放在一個提供生活所需以及財力擺設的環境中，檢測老鼠在快樂的環境下是否會繼續食用嗎啡。,
囚牛,畜牧,傳說,自然現象,傳說,明朝李東陽《記龍生九子》：囚牛，龍種，平生好音樂。今胡琴頭刻獸是其遺像。形狀有角黃色，喜歡聽音樂，所以很多樂師都用他的樣貌雕刻樂器進行雕塑。,
紫婆婆,都市傳說,著名人物,地區名稱,都市傳說,日本的都市傳說，為穿著紫色和服的老婆婆。紫婆婆會問你喜歡什麼顏色，如果回答「紫色」就不會攻擊你。此外，如果穿著紫色的衣服，也不會被攻擊。,
伏尼契手稿,書本,繪畫,樂譜,書本,一本內容不明的神秘書籍，附有插圖，卻與內文完全沒有關聯，似乎是中世紀煉金術士之參考書籍。命名原因是當時的購買者名叫伏尼契的波蘭商人。,
鐵處女像,藝術品,刑具,工具,刑具,中世紀歐洲用來處決或刑求的一種酷刑刑具，表示與埃及木乃伊棺材非常相似的刑具，內部有鐵製的尖刺，用於使犯人致死，因此過殘忍而遭到當時皇室的禁用。,
青藍冰火,文學,酒精飲料,化學現象,文學,一個成語，意思是「青出於藍，冰寒於水」的簡化說法。比喻學生超過老師或後人勝過前人。,
國士鍊成陣,動畫,法律,藝術品,動畫,動畫「鋼之鍊金術師」中的反派為了得到更多的生命能量，將整個國家設計成煉金術的陣法，並計畫消滅整個國家的所有生命來加強自己的能力。,
地球三明治,流行,食物,議題,流行,一個幽默的網絡挑戰，兩人站在地球的兩個對立點，各自把一塊面包放在地上，便可以把地球夾在兩塊面包中間。,
防守聖經獎,藝術,名人,運動,運動,是美國職業棒球聯賽從2006年開始的一個年度方法的獎項，在不防守位置，各選出一位防守表現最為杰出的球員並頒發獎項。,
瘋狂山脈,文學,氣象,化學,文學,是美國克蘇魯文化之父洛夫克拉夫特於1963年發表的科幻恐怖小說，講述一個考察隊在南極山脈上的發現之旅。,
胡杰哲,藝術,名人,歷史,藝術,查無此人，純屬虛構。,
金斯柏勒陰謀,政治,軍事,宗教,政治,發生於1605年，是一群英格蘭天主教極端分子試圖炸毀英國國會大廈，並殺害正在參加國會開幕典禮的英國國王詹姆士一世的失敗的暗殺行動。這次事件是1603年的主要陰謀（Main Plot）和次要陰謀（Bye Plot）之後又一次失敗的弒君企圖。,
奇異吸子,科幻,數學,用品,數學,是存在混沌系統中規律秩序的線索，是某些元素或力量浮現出來成為一個中心的組成部分環繞著事件運轉循環，其模式型態是環繞著奇異吸子潛藏在混沌系統裡發展。,
羊駝角,動物,地名,神話,地名,芬蘭某個寧靜的海角，然而當地卻沒有任何羊駝的存在，僅因為當地長老的女兒非常喜歡羊駝，故藉由羊為其海角命名。,
蒜頭村,人文,農作物,宗教,人文,位於臺灣嘉義縣六腳鄉東南部，有朴子溪流經，為六腳鄉鄉治所在地。自古富庶，有「九萬二千」之俗諺，意指當地大戶人家眾多，堪稱首善之區，所以名叫「算頭」，音就為「蒜頭」。,
玻璃山,神話,歷史,文學,神話,一則帶有寓言色彩的故事，在紐約的鬧市區，山下散落著無數因攀爬玻璃山失敗而喪命的人們的屍體。然而，主人公借助兩把廁所刷子痛苦卻勇敢地在玻璃山上爬。四周旁觀的行人不停地咒罵、嘲笑並等著看他的笑話，但儘管如此，主人公依然堅持往上爬，最終他登上峰頂，找到那個中了魔法的美麗象徵。不幸的是，他用手一碰，它就變成了一個美麗的公主。極度失望之下，他將公主失手往山腳下觀望的行人中拋去。,
囚徒困境,心理學,理論,電影,心理學,是賽局理論的非零和賽局中具代表性的例子，反映個人最佳選擇並非群體的最佳選擇，且在一個群體中，個人做出理性選擇卻往往導致集體的非理性。雖然這是一個理論上的情境，但現實中的價格競爭等也會出現類似情況。,
WHY,法律,地名,外國,地名,一個美國小鎮，本身因為位於Y字路口之間所以叫Y，但法律規定最少有3個字母，所以改名叫WHY。,
笨蛋三明治,影視,餐飲,傳說,影視,美國真人秀《地獄廚房》知名訓話片段，廚藝學院頭部明星主廚戈登拉姆齊拿吐司並重複「我是一个笨蛋三明治」。,
底護五世,歷史,甜點,人物,甜點,一種源於尼瓜拉瓜的蛋糕，將蛋糕浸泡於酒，再鋪上一層卡仕達醬，並撒上肉桂粉。名稱源於一個教宗。,
螞蟻吸允,地名,植物,寓言,地名,「螞蟻吸允」這個名字可追溯到19世紀。阿肯色河上的汽船船員常到這個小鎮酗酒，喝得肚子像螞蟻那樣鼓起來，小鎮因此得名。,
鬼蓮頭,電影,遊戲,食物,食物,燒賣的別稱，古代燒賣外型像豎起的頭髮，因而得名，此名稱出自清代的《揚州畫舫錄》。,
黑白熊事件,動物,動漫,飲料,動漫,1987年的元旦，台灣一家動物園展出了一隻疑似大熊貓的黑白熊，當時被誤認為台灣出現的野生熊貓，後來才發現這是一個人工塗色的商業噱頭。,
紅皇后假說,歷史,童話,心理學,歷史,生物學理論，指生物必須不停演化才能生存。引申自《愛麗絲夢遊仙境》中紅心皇后的對白：「你必須不停的跑，才能保持在原地」。,
綠孩童,靈異,人物,藝術,靈異,1887年8月的一天，在西班牙班賀斯附近，人們突然看見從山洞裡走出兩個綠孩子。人們不敢相信自己的眼睛，這兩個孩子皮膚是綠色的，衣服也從未見過。後來男孩死亡，女孩存活數年，來源成謎。,
4分33秒,音樂,動物,物理,音樂,一首著名的演奏樂曲，但沒有任何樂器的聲音，表演者只會做出擦汗、開合琴蓋等動作，有稱為「四分半的寂靜」。,
BJ聯盟,運動,時空,戰爭,運動,日本的職業籃球賽聯盟，在2016年中止，BJ的意思是Basketball Japan的縮寫。,
Doctor Who,影視,家電,大學,影視,是一款由BBC在1963年開始製作的科幻電視劇，中文譯名為神秘博士，講述一個博士作為時間管理者的冒險經歷。,
Ten-Four,航空,運動,警察,警察,Ten-Four是二十世紀初的通訊用語，表示收到消息、知道、立即執行等意思，目前常用於美國警察通訊術語。,
梧桐樹條約,股票,生態,政治,政治,梧桐樹條約是一個虛構或象徵性的名稱，常被用來指涉結合經濟利益、生態保護與政治談判的協議，用於討論政策如何在多重價值之間取得平衡。,
伊頓混亂,戰爭,疾病,甜點,甜點,伊頓混亂是一種經典的英式甜點，將蛋白霜、鮮奶油與水果混合，外觀雜亂卻口感豐富，也常被引申用來形容混合卻和諧的狀態。,
斯特魯普效應,反應,人口,小行星,反應,斯特魯普效應是心理學中的經典現象，描述人在處理文字意義與顏色資訊衝突時，反應時間會明顯變慢，顯示注意力資源的限制。,
西施舌,動物,美女,動作,動物,西施舌是一種貝類海鮮，因外型特殊而得名，常見於高級料理中，同時也因名稱帶有文化聯想而廣為人知。,
卡美洛,甜點,歷史,運動,歷史,卡美洛是亞瑟王傳說中的理想王國象徵，代表正義、榮耀與騎士精神，在文學與歷史想像中具有重要地位。,
卡瓦帝之舞,宗教,音樂,群聚,宗教,卡瓦帝之舞是一種源自印度教的宗教儀式舞蹈，信徒透過音樂、舞動與身體負重來展現虔誠與精神修行。,
黑老虎,水果,槍械,天氣,水果,黑老虎是一種水果或品種名稱，因外觀或色澤深沉而得名，名稱強烈，常讓人誤以為與動物或武器相關。,
波士頓動力,甜點,暗號,企業,企業,波士頓動力是一家知名科技公司，以研發先進機器人聞名，其產品常展示高度的動作協調與工程技術實力。,
奧菲斯蛋,動物,神話,軍火,神話,奧菲斯蛋帶有神話色彩，名稱源自古代傳說，常被用來指涉具有象徵意義或神秘起源的物件或概念。,
波士文法案,運動,環境,稅收,稅收,波士文法案通常指與稅收或制度改革相關的法案名稱，用來討論政府如何透過法規影響經濟行為與社會結構。,
水晶之夜,調酒,動畫,藝術,藝術,水晶之夜原本是歷史名詞，也常被借用於藝術或文化作品中，象徵破碎、轉折與黑暗時期的開始。,
綠閃光,動漫,方言,自然,自然,綠閃光是一種罕見的大氣光學現象，常出現在日落或日出瞬間，因色彩特殊而在自然觀測與文化中廣受討論。,
摩爾定律,遊戲,科技,數理,科技,摩爾定律描述半導體技術中電晶體數量隨時間倍增的趨勢，長期影響科技產業發展與運算能力提升。,
羽·泉,音樂,文學,景點,音樂,羽·泉是華語樂壇的重要音樂組合，以流行搖滾風格與廣泛傳唱的歌曲，在華語音樂史上佔有一席之地。,
松鼠鱘魚,食物,共生,特有種,特有種,松鼠鱘魚是一種名稱特殊的生物，常用來指涉具有地域性或生態獨特性的物種，引發人們對生物多樣性的關注。,
樓外樓,科幻,餐廳,氣候異常,餐廳,樓外樓是知名餐廳或文化品牌名稱，常出現在歷史與文學中，象徵飲食文化與地方傳統的結合。,
克林尼索,藝人,地區,貨幣,地區,克林尼索常被用作地名或文化稱呼，可能涉及特定區域的歷史背景與人文特色，名稱本身具有辨識性。,
幻椅式,運動,人際關係,動漫,運動,幻椅式是一種常見的體能或團隊活動動作，看似坐在空椅上，實際考驗下肢力量與團隊協調能力。,
抽象速度,物理,美術,動物,物理,抽象速度是一種概念性說法，用來描述難以具象化的速度感受，常出現在物理討論或藝術表現中。,
灰姑娘效應,密碼,心理學,時間,心理學,灰姑娘效應是心理學概念，描述繼親家庭中子女受到不公平對待的現象，常用於探討家庭結構與心理影響。,
辟剋,洗潔劑,五金,餐具,洗潔劑,辟剋是一種商品或品牌名稱，常見於清潔用品領域，名稱簡短有力，容易在市場中建立辨識度。,
藍色時期,歷史,藝術,政治,藝術,畢卡索在1900到1904年之間的創作時期，主要以陰鬱的藍色與藍綠色作畫，題材多表現貧困、孤獨與憂鬱情緒，為其重要藝術階段之一。,
芝加哥過濾器,社會,心理,行為,心理,指人們會依據所在地改變自身行為的心理現象，名稱來自芝加哥人被認為在外地表現得特別有禮貌的說法。,
利可靈,用品,化學,醫學,化學,又稱Iscorine，是石蒜科植物中發現的生物鹼，具有神經毒性，可能引起嘔吐等中毒反應。,
斐波那契數列,數學,藝術,自然,數學,一種數列結構，每一項皆為前兩項之和，廣泛出現在數學、生物與藝術比例中。,
神雪,宗教,藝術,人物,人物,日本模特兒與AV女優藝名，活躍於寫真與成人影像領域，所屬事務所為CAPSULEAGENCY。,
超級無敵我愛你,故事,動漫,影視,動漫,出自香港動漫作品中的虛構招式名稱，具有誇張與戲劇化特色。,
第34條法則,流行,網路,藝術,網路,網路文化中的非正式法則，主張任何事物都能在網路上找到色情相關內容。,
第二本書,歷史,政治,文學,歷史,希特勒未正式出版的著作，延續其極端政治思想，僅在後世被研究與整理。,
金屬,災難,謠報,樂器,樂器,冷戰時期的高階竊聽裝置，無需電源即可接收特定微波訊號。,
金熊獎,典禮,獎項,動物,典禮,柏林影展最高榮譽獎項之一，象徵電影藝術成就。,
軍刀綜合症,醫學,軍事,病症,醫學,一種罕見的先天性肺部血管異常疾病，因影像形似彎刀而得名。,
靠櫃玻璃,養殖,網路,感情,網路,源自網路用語，形容商品在櫃位前展示卻未實際販售的狀態。,
糞肥,購物,股票,植物,植物,由有機廢棄物製成的肥料，用於補充土壤養分並促進作物生長。,
流氓熊貓,遊戲,電影,動物,遊戲,出自電玩作品中的角色設定，性格兇狠但具人氣。,
冒煙測試,天災,程序,情侶,程序,軟體測試方法之一，用來快速檢查系統是否能基本運作。,
美麗的分泌物,生理,香水,心理學,香水,帶有獵奇風格的小眾香水，氣味模擬人體分泌物，引發話題。,
莫札特技術,海洋,電影,飲食,飲食,一種低溫乾燥保存技術，名稱取其縮寫，用於食品加工。,
曲折金字塔,心理學,埃及,經濟,埃及,曲折金字塔（Bent Pyramid）是位於埃及代赫舒爾（Dahshur）的一座金字塔，為埃及第四王朝法老斯尼夫魯時期所建造，是一座曲折金字塔。曲折金字塔是一個早期金字塔發展出的奇特範例，也是斯尼夫魯的第二座金字塔。考古學家相信曲折金字塔代表了一個金字塔由階梯金字塔轉變為表面光滑金字塔的過渡時期。,
日日日,文學,占卜,密碼,文學,一位日本的男性小說家，名字來源於晶字拆分，著作有《狂亂家族日記》。,
燒尻島,神話,地名,宗教,地名,一個位於日本北海道西方的島嶼，人口約三百人，名稱的意思是附近的島，源於日本少數民族的語言。,
舌尖效應,人文,心理學,生理,心理學,話到嘴邊卻突然想不起來的現象，是因為大腦對記憶內容的展示性抑制所造成的。,
生命之星,政治,藝術,標誌,標誌,表示急救單位或該人員的標誌，在各國的急救單位都會使用。呈藍色，六邊突出的星形，並在中間加上阿斯克勒庇俄斯之杖。,
史高維爾指標,登山,食品,財經,食品,是1912年由美國化學家所制定的測量辣椒素含量的一項指標，他的實驗方法是將被測物加一單位的辣椒素逐步溶解到糖水裡，然後交給不同人品嘗，直到無法嘗出辣味為止。,
